{
  "artifact_type": "page_research_package",
  "version": 1,
  "identity": {
    "project": "stealthrdp",
    "canonical_domain": "www.stealthrdp.com",
    "country": "US",
    "locale": "en-US",
    "open_seo": {
      "project_id": "stealthrdp",
      "location_code": 2840,
      "language_code": "en"
    }
  },
  "status": "approved",
  "asset_type": "article",
  "target_query": "vps for web hosting",
  "secondary_queries": [],
  "target_reader": "Developers, site owners and small teams deciding whether a website/application needs a VPS.",
  "intent": "Informational/commercial investigation: decide when VPS web hosting is appropriate and how to size it.",
  "serp_evidence": [
    {
      "kind": "serp",
      "reference": "https://rafftechnologies.com/learn/guides/vps-for-web-hosting",
      "note": "Current web-hosting decision guide",
      "project_id": "stealthrdp",
      "country": "US",
      "locale": "en-US",
      "retrieved_at": "2026-09-27"
    },
    {
      "kind": "serp",
      "reference": "https://aws.amazon.com/what-is/vps/",
      "note": "Authoritative VPS background",
      "project_id": "stealthrdp",
      "country": "US",
      "locale": "en-US",
      "retrieved_at": "2026-09-27"
    }
  ],
  "competing_pages": [
    "https://rafftechnologies.com/learn/guides/vps-for-web-hosting",
    "https://aws.amazon.com/what-is/vps/"
  ],
  "existing_results_do_well": [
    "Explain control benefits and common application stacks.",
    "Compare VPS with shared hosting and mention operational responsibility."
  ],
  "existing_results_miss": [
    "Concise whole-stack sizing model tied to CPU/RAM/storage/network.",
    "Clear cases where shared/managed hosting remains better.",
    "Internal architecture into StealthRDP's existing OS/performance articles."
  ],
  "related_questions": [],
  "unique_value": "A workload-first decision guide that covers when not to use a VPS, whole-stack sizing, OS choice, operations and growth beyond a single VM.",
  "required_facts_evidence": [
    ".sageprime/project-truth/manifest.json",
    "src/content/plans.json"
  ],
  "internal_link_opportunities": [
    "/plans",
    "/blog/windows-vs-linux-vps-which-os-best-fits-your-business.html",
    "/blog/common-vps-hosting-issues-and-their-solutions.html",
    "/blog/common-vps-performance-bottlenecks.html"
  ],
  "commercial_connection": "Reader can compare current VPS tiers after identifying the application's real resource and administration needs.",
  "conversion_path": "/plans",
  "cannibalization": "No current StealthRDP article owns this selection intent.",
  "existence_question": "Why should vps-for-web-hosting exist when search already has competing results?",
  "existence_decision": "produce"
}
