{
  "artifact_type": "page_research_package",
  "version": 1,
  "identity": {
    "project": "stealthrdp",
    "canonical_domain": "www.stealthrdp.com",
    "country": "US",
    "locale": "en-US",
    "open_seo": {
      "project_id": "stealthrdp",
      "location_code": 2840,
      "language_code": "en"
    }
  },
  "status": "approved",
  "asset_type": "article",
  "target_query": "vps for trading",
  "secondary_queries": [],
  "target_reader": "People running permitted trading terminals, EAs or API bots who are evaluating remote infrastructure.",
  "intent": "Informational/commercial investigation focused strictly on infrastructure, not investment advice.",
  "serp_evidence": [
    {
      "kind": "serp",
      "reference": "https://servury.com/blog/best-vps-for-trading-what-actually-matters-beyond-price/",
      "note": "Trading VPS selection result",
      "project_id": "stealthrdp",
      "country": "US",
      "locale": "en-US",
      "retrieved_at": "2026-09-27"
    },
    {
      "kind": "serp",
      "reference": "https://thetradingexpert.com/learn/guides/trading-vps-selection-guide",
      "note": "Trading VPS infrastructure guide",
      "project_id": "stealthrdp",
      "country": "US",
      "locale": "en-US",
      "retrieved_at": "2026-09-27"
    }
  ],
  "competing_pages": [
    "https://servury.com/blog/best-vps-for-trading-what-actually-matters-beyond-price/",
    "https://thetradingexpert.com/learn/guides/trading-vps-selection-guide"
  ],
  "existing_results_do_well": [
    "Emphasize broker/exchange proximity, reliability and software resource needs.",
    "Explain that placement can affect network latency."
  ],
  "existing_results_miss": [
    "Strong separation between infrastructure quality and trading outcome.",
    "Provider-neutral wording that avoids fake universal latency/spec targets.",
    "Explicit recovery/update planning."
  ],
  "related_questions": [],
  "unique_value": "A cautious infrastructure-only guide: endpoint proximity, continuity, resource sizing, OS fit and restart planning, with an explicit statement that a VPS cannot make a strategy profitable or remove risk.",
  "required_facts_evidence": [
    ".sageprime/project-truth/manifest.json",
    "src/content/plans.json"
  ],
  "internal_link_opportunities": [
    "/plans",
    "/blog/8-signs-you-need-to-upgrade-your-vps-resources.html"
  ],
  "commercial_connection": "Current VPS tiers are relevant as infrastructure options after the reader identifies endpoint, OS and software requirements.",
  "conversion_path": "/plans",
  "cannibalization": "No existing StealthRDP article owns trading VPS selection intent.",
  "existence_question": "Why should vps-for-trading exist when search already has competing results?",
  "existence_decision": "produce"
}
