{
  "artifact_type": "page_research_package",
  "version": 1,
  "identity": {
    "project": "stealthrdp",
    "canonical_domain": "www.stealthrdp.com",
    "country": "US",
    "locale": "en-US",
    "open_seo": {
      "project_id": "stealthrdp",
      "location_code": 2840,
      "language_code": "en"
    }
  },
  "status": "approved",
  "asset_type": "article",
  "target_query": "vps for remote desktop",
  "secondary_queries": [],
  "target_reader": "People evaluating a VPS as a persistent remote workstation or Windows desktop.",
  "intent": "Informational/commercial investigation: decide whether a VPS fits remote-desktop use and how to choose resources.",
  "serp_evidence": [
    {
      "kind": "serp",
      "reference": "https://rafftechnologies.com/windows-server/windows-vps-for-remote-desktop",
      "note": "Decision-oriented RDP VPS guide",
      "project_id": "stealthrdp",
      "country": "US",
      "locale": "en-US",
      "retrieved_at": "2026-09-27"
    },
    {
      "kind": "serp",
      "reference": "https://cloud.google.com/learn/what-is-a-virtual-private-server",
      "note": "VPS use-case background",
      "project_id": "stealthrdp",
      "country": "US",
      "locale": "en-US",
      "retrieved_at": "2026-09-27"
    }
  ],
  "competing_pages": [
    "https://rafftechnologies.com/windows-server/windows-vps-for-remote-desktop",
    "https://skynethosting.net/blog/vps-as-remote-desktop/"
  ],
  "existing_results_do_well": [
    "Explain what an RDP VPS is and how remote desktop access works.",
    "Discuss latency, RAM and Windows requirements."
  ],
  "existing_results_miss": [
    "Clear separation between RDP as an access protocol and VPS as the server product.",
    "Strong cannibalization-aware links to dedicated security/performance guidance.",
    "Provider-neutral limitation cases where a VPS is not the right workstation."
  ],
  "related_questions": [],
  "unique_value": "A decision and sizing guide that explains latency, application-driven RAM/CPU sizing and Windows licensing, while sending security/performance sub-intents to existing StealthRDP articles.",
  "required_facts_evidence": [
    ".sageprime/project-truth/manifest.json",
    "src/content/plans.json",
    "src/content/docs-articles.json"
  ],
  "internal_link_opportunities": [
    "/plans",
    "/docs/windows-licensing",
    "/blog/7-tips-for-securing-your-remote-desktop-connection.html",
    "/blog/5-ways-to-optimize-your-rdp-performance-for-remote-work.html"
  ],
  "commercial_connection": "Natural next step is comparing current VPS resource tiers after the reader knows whether remote desktop fits.",
  "conversion_path": "/plans",
  "cannibalization": "New URL owns selection/sizing. Existing RDP articles retain security and performance-optimization intent.",
  "existence_question": "Why should vps-for-remote-desktop exist when search already has competing results?",
  "existence_decision": "produce"
}
